{
  "schema_version": "1.0",
  "call_id": "discovery_acme",
  "classification": {
    "call_type": "discovery",
    "phase": "pre-sales",
    "confidence": 0.9,
    "rationale": "A scheduled first substantive conversation. The rep opens with an agenda, spends the majority of the call asking open questions about current state, priorities, impact, and decision-makers, and only shows the product briefly near the end. The ask is information and a next step, not a purchase.",
    "alternatives": [
      { "call_type": "demo", "confidence": 0.08 }
    ]
  },
  "outcomes": [
    {
      "id": "quantify-priority",
      "statement": "Identify and quantify Acme's top priority (data trust / single source of truth) and the cost of inaction. Largely achieved on time and consequences; the dollar figure stayed an estimate rather than a defensible model.",
      "status": "partial",
      "evidence": [
        { "speaker": "Sam", "text": "she's probably spending fifteen hours a week just on data wrangling. That's almost half her job." },
        { "speaker": "Sam", "text": "I'd say hundreds of thousands of dollars isn't crazy." },
        { "speaker": "Sam", "text": "We're about to close our Series B. The board is going to want operational visibility." }
      ]
    },
    {
      "id": "map-decision-process",
      "statement": "Map who decides and how. Jordan identified the VP of Finance and Head of Operations as required for sign-off, but did not map the steps, criteria, or budget, and the budget question was deflected.",
      "status": "partial",
      "evidence": [
        { "speaker": "Sam", "text": "Nothing this size gets signed off without Finance. And if we're touching Operations data, she'd want to be involved too." },
        { "speaker": "Sam", "text": "I honestly don't know yet. We haven't gotten that far. I'm in discovery mode myself." }
      ]
    },
    {
      "id": "secure-next-step",
      "statement": "Secure a concrete, calendared next step with the right people. Missed: the call ended on 'send me a summary' with no scheduled meeting and the key stakeholders left unconfirmed.",
      "status": "missed",
      "evidence": [
        { "speaker": "Sam", "text": "Sure, send that over. I'll take a look." },
        { "speaker": "Sam", "text": "Maybe. Let me feel it out with them first." }
      ]
    }
  ],
  "scores": [
    {
      "criterion_id": "agenda_and_framing",
      "criterion_name": "Agenda & Framing",
      "score": 82,
      "band": "great",
      "weight": 1,
      "rationale": "Proposed a clear three-part agenda, checked for agreement, and explicitly invited the buyer to redirect. Buyer-centric and efficient.",
      "evidence": [
        { "speaker": "Jordan", "text": "I put together a quick agenda... we'd spend a few minutes making sure I understand what's going on in your world, then... your priorities... and if it makes sense, we can talk about whether Northstar fits. Sound okay?" },
        { "speaker": "Jordan", "text": "feel free to stop me if I'm heading in the wrong direction." }
      ]
    },
    {
      "criterion_id": "current_state",
      "criterion_name": "Current State & Why It Isn't Working",
      "score": 88,
      "band": "great",
      "weight": 1.5,
      "rationale": "Excellent layering: established scale and growth, then drilled from 'a shared Google Sheet' into the specific breakdowns (analyst time, conflicting dashboards, exec disputes) using 'tell me more' and 'how long' follow-ups.",
      "evidence": [
        { "speaker": "Sam", "text": "there are three different versions of the same dashboard floating around in different departments. Finance sees one number, Operations sees another." },
        { "speaker": "Jordan", "text": "Tell me more about 'not really.'" }
      ]
    },
    {
      "criterion_id": "priority_quantified",
      "criterion_name": "Top Priority Identified & Quantified",
      "score": 76,
      "band": "good",
      "weight": 2,
      "rationale": "Strong: the priority is named in the buyer's words and tied to time (15 hrs/week), bad decisions, and a board-level consequence. Held back from 'great' because the dollar impact stayed a gut estimate ('hard to quantify exactly') rather than a co-built model.",
      "evidence": [
        { "speaker": "Sam", "text": "she's probably spending fifteen hours a week just on data wrangling." },
        { "speaker": "Sam", "text": "Hard to quantify exactly but I'd say hundreds of thousands of dollars isn't crazy." }
      ]
    },
    {
      "criterion_id": "future_state",
      "criterion_name": "Ideal Future State",
      "score": 85,
      "band": "great",
      "weight": 1,
      "rationale": "Used a clean future-state question and let the buyer paint the picture, then reflected it back crisply — making the gap (and the value) tangible.",
      "evidence": [
        { "speaker": "Jordan", "text": "If you woke up six months from now and this was fixed — what would be different?" },
        { "speaker": "Sam", "text": "One version of the truth... My analyst doing actual analysis, not data janitorial work. And... me being able to walk into a board meeting and not worry about someone challenging my numbers." }
      ]
    },
    {
      "criterion_id": "decision_process",
      "criterion_name": "Decision Process & Stakeholders",
      "score": 55,
      "band": "developing",
      "weight": 1.5,
      "rationale": "Identified the two stakeholders required for sign-off, which is good. But stopped there: no decision criteria, no steps/timeline for how a decision gets made, budget probed once and dropped, and the stakeholders were not secured into the next step.",
      "evidence": [
        { "speaker": "Jordan", "text": "Who else at Acme cares about this problem the way you do?" },
        { "speaker": "Sam", "text": "Nothing this size gets signed off without Finance." }
      ]
    },
    {
      "criterion_id": "timing_urgency",
      "criterion_name": "Compelling Event & Timing",
      "score": 80,
      "band": "great",
      "weight": 1,
      "rationale": "Surfaced a genuine, dated compelling event (Series B close, end of Q3, board expectations) and connected it to the need to act — a real forcing function.",
      "evidence": [
        { "speaker": "Sam", "text": "We're about to close our Series B. The board is going to want operational visibility." },
        { "speaker": "Sam", "text": "Should be end of Q3." }
      ]
    },
    {
      "criterion_id": "avoided_premature_pitch",
      "criterion_name": "Avoided Premature Pitching",
      "score": 60,
      "band": "good",
      "weight": 1,
      "rationale": "Mostly disciplined — the pitch came late, after substantial discovery, and Jordan returned to questioning afterward. But he volunteered a feature monologue and an implementation reassurance before fully closing out priorities, slightly ahead of earning it.",
      "evidence": [
        { "speaker": "Jordan", "text": "can I show you quickly what Northstar does?" },
        { "speaker": "Jordan", "text": "our implementation team is pretty hands-on — your analyst wouldn't need to do a ton of heavy lifting on the technical side." }
      ]
    },
    {
      "criterion_id": "next_steps",
      "criterion_name": "Clear Next Steps with the Right People",
      "score": 38,
      "band": "poor",
      "weight": 1.5,
      "rationale": "The weakest part of an otherwise strong call. It ended on an open-ended 'I'll send a summary' with no calendared meeting, and the attempt to bring in Finance and Operations was left to the buyer to 'feel out' rather than secured.",
      "evidence": [
        { "speaker": "Jordan", "text": "What would make sense as a next step? I'm thinking I could put together a summary of what we discussed..." },
        { "speaker": "Sam", "text": "Maybe. Let me feel it out with them first." }
      ]
    }
  ],
  "overall_score": 70,
  "summary": "A strong discovery call with textbook current-state, future-state, and compelling-event work — Jordan built a clear, buyer-owned picture of the data-trust problem and its board-level stakes. The deal is being left on the table at the finish: impact never became a defensible ROI number, the decision process is only half-mapped, and the call closed without a calendared next step or committed stakeholders. Biggest lever: convert the impact into a dollar model and lock a specific next meeting with Finance and Operations.",
  "coaching": {
    "strengths": [
      {
        "title": "Layered discovery that earned the truth",
        "detail": "Jordan didn't accept the first answer. He moved from a surface complaint ('not really') down through specific examples, duration, and prior attempts to fix — the buyer ended up articulating the pain, the trust spiral, and the cost themselves. That's the discovery doing the selling.",
        "criterion_id": "current_state",
        "evidence": [
          { "speaker": "Jordan", "text": "Tell me more about 'not really.'" },
          { "speaker": "Jordan", "text": "How long has that been the case — the trust issue?" }
        ],
        "priority": "low"
      },
      {
        "title": "Surfaced a real compelling event",
        "detail": "Rather than leaving timing vague, Jordan tied the problem to the Series B close and board expectations, and got a date (end of Q3). That forcing function is what will keep this deal from stalling.",
        "criterion_id": "timing_urgency",
        "evidence": [
          { "speaker": "Jordan", "text": "what happens if you don't solve this in the next six months?" }
        ],
        "priority": "low"
      },
      {
        "title": "Future-state framing that made the gap vivid",
        "detail": "The 'wake up six months from now' question got the buyer to describe success in their own words, including the emotional board-meeting payoff — a gift for the business case later.",
        "criterion_id": "future_state",
        "evidence": [